geo_point_2d,geo_shape,gml_id,nom_du_projet,gid,fiche_diffusable,type,quartier,nombre_de_logements,lien_vers_la_page_internet,annee_de_livraison,etat,maitrise_d_ouvrage,maitrise_d_oeuvre,description_du_projet,description_resumee,image_pour_infobulle_gp,programmes_d_actions
"47.2815702775,-2.233109195","{""type"": ""Point"", ""coordinates"": [-2.233109194999409, 47.281570277513424]}",_515b5a38-5002-11eb-9f5c-cb34563f85d6.,Désenclavement du Petit-Caporal,74,1,Equipement / Aménagement,Nord,,https://bit.ly/386gZuh,2021,Travaux en cours,Ville de Saint-Nazaire,Myrtille Fakhreddine,Acquisition de l'ancienne ferme du petit caporal afin de désenclaver le quartier et de créer des équipements.,"La Ville a acheté l'ancienne ferme du Petit Caporal afin de créer une voirie entre les rues Piccard et Gutenberg. Le projet prévoit également la création de cheminements et d'une placette. Les bâtiments seront réhabilités pour accueillir des activités, notamment dans le domaine de la santé.",https://www.saintnazaire.fr/fileadmin/_processed_/3/9/csm_projet_desenclavement_f3014d0929.jpg,PRIR
"47.2690262771,-2.24373729175","{""type"": ""Point"", ""coordinates"": [-2.243737291752856, 47.269026277144114]}",_515b5a38-5002-11eb-9f5c-cb34563f85d6.,Reton,68,1,Habitat,Quartier ouest,51.0,https://bit.ly/3gC5Iam,2024,A l'étude,SILENE,,"Sur ce site, la collectivité a décidé de mobiliser une partie du foncier au profit de l’office public de l’habitat Silène, afin de créer un quartier mixte. Il est prévu de réaliser une cinquantaine de logements dont une quarantaine en logement locatif social et le reste en lot libre et en accession aidée. L'opération prévoit également l'aménagement et la valorisation des espaces paysagers et des liaisons douces existantes sur le site.",,https://www.saintnazaire.fr/fileadmin/images/BD-Bayet_Escurat_et_Reton_-_vue_aerienne_perimetres_des_operations.jpg,
"47.2803766315,-2.21696486002","{""type"": ""Point"", ""coordinates"": [-2.216964860016339, 47.28037663153442]}",_515b5a38-5002-11eb-9f5c-cb34563f85d6.,Le Fanal,26,1,Habitat,centre-ville,43.0,https://bit.ly/3balOom,2021,Travaux en cours,SONADEV - SILENE,Menguy Architecte - G. Sevin Paysage,"Sur le site de l’ancien cinéma Le Fanal à proximité de la médiathèque, la Ville de Saint-Nazaire a confié à la Sonadev le soin de réaliser une opération d’aménagement en vue d’y construire 43 nouveaux logements. Cette opération comprendra pour moitié des logements locatifs sociaux construits par Silène et pour l’autre moitié des maisons de ville.","A proximité de la médiathèque, cette opération d'aménagement prévoit 43 logements (collectifs et individuels).",https://www.saintnazaire.fr/fileadmin/Saint-Nazaire/02.Vie_municipale/Competences/Projets_urbains/Habitat/vue_operation_SILENE.png,Action coeur de ville
"47.2557868361,-2.26046738962","{""type"": ""Point"", ""coordinates"": [-2.26046738962382, 47.25578683608444]}",_515b5a38-5002-11eb-9f5c-cb34563f85d6.,Vecquerie,48,1,Habitat,Saint-Marc-sur-mer,500.0,https://bit.ly/30cEqxW,2024,Travaux en cours,ADI - SILENE,,Création d'environ 500 logements entre la route de Saint-Marc et la route de la Vecquerie.,"Entre les routes de Saint-Marc et de la Vecquerie, face au bois de Porcé, ce projet prévoit la construction d'environ 500 logements.",https://www.saintnazaire.fr/fileadmin/Saint-Nazaire/02.Vie_municipale/Competences/Projets_urbains/Habitat/Vecquerie1.jpg,
"47.2759680771,-2.20335960388","{""type"": ""Point"", ""coordinates"": [-2.203359603881831, 47.27596807711781]}",_515b5a38-5002-11eb-9f5c-cb34563f85d6.,Tête de l'alvéole 12,138,1,Equipement / Aménagement,centre-ville,,https://bit.ly/3e6heZi,2022,A l'étude,,,"Il s’agit d’un appel à candidature place à prendre ""Ambition Maritime"". Les candidats sont amenés à proposer différentes activités : animations ludiques et pédagogiques, bar et restauration, hébergements touristiques…",,https://www.saintnazaire.fr/fileadmin/_processed_/c/8/csm_SNAG_0185938_17_99af504ab0.jpg,Ambition maritime
"47.2601385014,-2.25629124859","{""type"": ""Point"", ""coordinates"": [-2.256291248590395, 47.26013850136134]}",_515b5a38-5002-11eb-9f5c-cb34563f85d6.,Boncour,47,1,Habitat,Quartier ouest,25.0,https://bit.ly/3sJ0ufG,2021,Travaux en cours,SONADEV,La ville est belle,25 lots pour la construction de logements individuels,"Dans le quartier de la Bouletterie, proche des commerces de la place Nadia Boulanger et de l'école, ce projet prévoit 25 lots pour des construction de logements individuels.",https://www.saintnazaire.fr/fileadmin/_processed_/7/1/csm_Boncour_ab991e65f9.jpg,
"47.2725127532,-2.21095440813","{""type"": ""Point"", ""coordinates"": [-2.210954408128288, 47.27251275321335]}",_515b5a38-5002-11eb-9f5c-cb34563f85d6.,Ilot Maudes,31,1,Habitat,centre-ville,55.0,https://bit.ly/2MMKf1Y,2023,Travaux en cours,ADI,BARRE LAMBOT Architecte,Création de 55 logements en plein cœur de ville dont 5 maisons de ville,"Situé en centre-ville et à proximité immédiate du front de mer, ce projet prévoit la construction de 55 logements (dont 5 maisons de ville) et le réaménagent du cœur d'ilot.",https://www.saintnazaire.fr/fileadmin/_processed_/7/b/csm_Le_Jardin_de_Maudes_-_Vue_aerienne_c10eecad9f.jpg,Action coeur de ville
"47.2931695997,-2.19084978104","{""type"": ""Point"", ""coordinates"": [-2.190849781036376, 47.2931695997061]}",_515b5a38-5002-11eb-9f5c-cb34563f85d6.,Parc de Méan,83,1,Equipement / Aménagement,Méan-Penhoët,,https://bit.ly/3e5a1tj,2021,Travaux en cours,CARENE,Lalu Tica,,"Suite à la réalisation du Boulevard des Apprentis, ce parc a pour objectif d'aménager des espaces publics de qualité pour faciliter la cohabitation entre les activités industrielles et les habitations.",https://www.saintnazaire.fr/fileadmin/images/Au_carrefour_des_rues_Emile-Combe_Clement-Ader_et_rue_de_Trignac__le_parking_est_transforme_en_aire_de_jeux_Sous_la_place_4_000_m3_de_retention_d_eaux_pluviales.jpg,
"47.2874611657,-2.2004880537","{""type"": ""Point"", ""coordinates"": [-2.200488053701794, 47.28746116571217]}",_515b5a38-5002-11eb-9f5c-cb34563f85d6.,Boulevard Leferme,41,1,Equipement / Aménagement,Méan-Penhoët,,https://bit.ly/3bcxZBf,2021,Livré,Ville de Saint-Nazaire et CARENE,BEAU,"Dans le cadre de la requalification de l'entrée de ville Est, le boulevard Leferme va être totalement réaménagé avec la création de large trottoirs, de pistes cyclables dans un environnement fortement végétalisé.","Dans le cadre de la requalification de l'entrée de ville Est, le boulevard Leferme va être totalement réaménagé avec la création de large trottoirs, de pistes cyclables dans un environnement fortement végétalisé.",https://www.saintnazaire.fr/fileadmin/_processed_/6/7/csm_Bd_Leferme_5_6cbac5cdca.jpg,
"47.2642909996,-2.23880767822","{""type"": ""Point"", ""coordinates"": [-2.238807678222654, 47.26429099958166]}",_515b5a38-5002-11eb-9f5c-cb34563f85d6.,Galicheraie,116,1,Habitat,Quartier ouest,258.0,https://bit.ly/3f6qPkp,2024,A l'étude,Silène,In Situ,"Dans le cadre du PRIR, Silène prévoit la réhabilitation et la résidentialisation des résidences Galicherais. Les espaces verts vont être réaménager, notamment pour accueillir un bassin de rétention des eaux pluviales.","Dans le cadre du PRIR, Silène prévoit la réhabilitation et la résidentialisation des résidences Galicherais. Les espaces verts vont être réaménager, notamment pour accueillir un bassin de rétention des eaux pluviales.",https://www.saintnazaire.fr/fileadmin/_processed_/1/9/csm_BD_Offenbach_arriere__c__IN_SITU_ARCHITECTURE__CULTURE_S__et_VILLE__fbb51e3996.jpg,PRIR
"47.2984995899,-2.18286752701","{""type"": ""Point"", ""coordinates"": [-2.182867527008055, 47.29849958989594]}",_515b5a38-5002-11eb-9f5c-cb34563f85d6.,Port de Méan,128,1,Equipement / Aménagement,Méan-Penhoët,,https://bit.ly/3hvryfA,2022,A l'étude,,,"Il s’agit d’un appel à candidature place à prendre ""Ambition Maritime"". Les candidats sont amenés à proposer différentes activités : animations ludiques et pédagogiques, bar et restauration, hébergements touristiques…",,https://www.saintnazaire.fr/fileadmin/_processed_/c/8/csm_SNAG_0185938_17_99af504ab0.jpg,Ambition maritime
"47.2807583781,-2.21481291871","{""type"": ""Point"", ""coordinates"": [-2.21481291870901, 47.28075837813586]}",_515b5a38-5002-11eb-9f5c-cb34563f85d6.,Les Halles,39,1,Equipement / Aménagement,Centre-ville,,https://bit.ly/307tMIu,2023,A l'étude,Ville de Saint-Nazaire,Atelier FERRET,"Ce bâtiment emblématique classé patrimoine du XXème siècle va faire l'objet d'une rénovation pour répondre aux besoins de confort, d'hygiène et d'accessibilité.","Ce bâtiment emblématique classé patrimoine du XXème siècle va faire l'objet d'une rénovation pour répondre aux besoins de confort, d'hygiène et d'accessibilité.",https://www.saintnazaire.fr/fileadmin/_processed_/0/9/csm_Le_Parvis_-_Ferret_Architectures_BD_b018751227.jpg,Action coeur de ville
"47.240364716,-2.27830844959","{""type"": ""Point"", ""coordinates"": [-2.27830844958602, 47.240364715967964]}",_515b5a38-5002-11eb-9f5c-cb34563f85d6.,Place Jacques Tati,33,1,Equipement / Aménagement,Saint-Marc-sur-Mer,,https://bit.ly/3e54ZgH,2022,Travaux en cours,Ville de Saint-Nazaire,BEAU,"Requalification de la place Jacques Tati en 2 phase :
- phase 1 : avenue de Saint-Nazaire, rue Sophie Tattischeff (voie nouvelle) et rue Adrien Pichon
-  phase 2 : place J. Tati
- Villa Kerarvan : requalification du parc pour une ouverte au public et vente de la villa.","Situé au cœur du quartier de Saint-Marc-sur-mer,  ce projet prévoit la refonte de la place Jacques Tati et de l'avenue de Saint-Nazaire afin de redonner plus d'espace et de confort aux piétons.",https://www.saintnazaire.fr/fileadmin/images/Place_Tati_2.jpg,Ambition maritime
"47.2819124887,-2.21245303116","{""type"": ""Point"", ""coordinates"": [-2.2124530311632, 47.281912488729105]}",_515b5a38-5002-11eb-9f5c-cb34563f85d6.,Bel Air,25,1,Habitat,Centre-Ville,21.0,https://bit.ly/3sPiODN,2021,Travaux en cours,SILENE,DLW François DUSSAUX architecte,Réalisation d'un collectif de 21 logements en locatif social,"En cœur de ville, ce projet prévoit un petit collectif de 21 logements en locatif social.",https://www.saintnazaire.fr/fileadmin/Saint-Nazaire/02.Vie_municipale/Competences/Projets_urbains/Habitat/011.jpg,Action coeur de ville
"47.2665240198,-2.25008158482","{""type"": ""Point"", ""coordinates"": [-2.250081584819846, 47.26652401975558]}",_515b5a38-5002-11eb-9f5c-cb34563f85d6.,Estu'R,45,1,Habitat,Quartier ouest,60.0,https://bit.ly/3sJ0ufG,2021,Travaux en cours,Cooplogis,Magnum,60 logements du T2 au T4,"Au cœur de la Chesnaie, à deux pas de l'école et de l'espace civique ce projet prévoit 60 logements collectifs en accession sociale.",https://www.saintnazaire.fr/fileadmin/_processed_/4/d/csm_Estu_R_eaa321c1ed.jpg,
"47.2747507564,-2.22828519436","{""type"": ""Point"", ""coordinates"": [-2.228285194362605, 47.274750756415976]}",_515b5a38-5002-11eb-9f5c-cb34563f85d6.,Jean Bouin - Oxygène,43,1,Habitat,Front de mer - Kerlédé,21.0,https://bit.ly/3uK6M0m,2023,A l'étude,SILENE,Jacques Boucheton Architectes,Construction de 21 logements locatifs sociaux sur la pointe nord est de la plaine de sports.,Construction de 21 logements locatifs sociaux sur la pointe nord est de la plaine de sports.,https://www.saintnazaire.fr/fileadmin/_processed_/1/5/csm_Perspective_2_Jacques_Boucheton_Architectes_d24bb0506c.jpg,
"47.2635659091,-2.24336907015","{""type"": ""Point"", ""coordinates"": [-2.243369070153646, 47.263565909054414]}",_515b5a38-5002-11eb-9f5c-cb34563f85d6.,Centre commercial de la Trébale et espaces publics,52,1,Equipement / Aménagement,Quartier ouest,,https://bit.ly/3q7wpEU,2026,A l'étude,SONADEV,"FAUN (architecte), Zephyr paysages, A2i infra, Systra (commerce, négo foncière)","Requalification du centre-commercial de la Trébale  avec la démolition de l'aile est et création de logements.
Requalification de la place Henri Fogel.","Construit en 1967, le centre commercial de la Trébale et la plage Henri Fogel sont vieillissant. Le projet va faire l'objet d'un volet commercial avec la restructuration et rénovation du centre commercial et d'un volet espaces publics avec le réaménagement de la place, de la rue des Lilas et la création d'un jardin public.",https://www.saintnazaire.fr/fileadmin/images/Esquisse_CC_Atelier_Georges.jpg,PRIR
"47.283859771,-2.23259099448","{""type"": ""Point"", ""coordinates"": [-2.232590994476473, 47.28385977100956]}",_515b5a38-5002-11eb-9f5c-cb34563f85d6.,Pole d'équipements Brossolette,51,1,Equipement / Aménagement,Nord,,https://bit.ly/3rdcExb,2023,Travaux en cours,Ville de Saint-Nazaire,Mabire Reich,"Création d'un pôle d'équipement sur le site de l'école Brossolette regroupant : 
- la crèche des petits clowns
- la salle polyvalente et les bureaux
- le périscolaire et l'ALSH
Création d'un parvis commun
Rénovation du  groupe scolaire","Ce projet va transformer le cœur du quartier du Petit Caporal avec la création d'un pôle d'équipements (crèche, centre de loisirs, salle polyvalente) et la rénovation de l'école Pierre Brossolette.",https://www.saintnazaire.fr/fileadmin/images/BD_2021_02_Brossolette_Presentation_projet_groupe_scolaire_Pierre_Brossolette-1.jpg,PRIR
"47.2645785895,-2.22613692284","{""type"": ""Point"", ""coordinates"": [-2.226136922836302, 47.26457858947682]}",_515b5a38-5002-11eb-9f5c-cb34563f85d6.,Goutte de lait,167,1,Equipement / Aménagement,front de mer - Kerlédé,,https://bit.ly/3hT727K,,A l'étude,,,"Il s’agit d’un appel à candidature place à prendre ""Ambition Maritime"". Les candidats sont amenés à proposer différentes activités : animations ludiques et pédagogiques, bar et restauration, hébergements touristiques…",,https://www.saintnazaire.fr/fileadmin/_processed_/c/8/csm_SNAG_0185938_17_99af504ab0.jpg,Ambition maritime
"47.2822913447,-2.22439807549","{""type"": ""Point"", ""coordinates"": [-2.224398075493061, 47.2822913446782]}",_515b5a38-5002-11eb-9f5c-cb34563f85d6.,Le Plessis,5,1,Habitat,Nord,367.0,https://bit.ly/3bbjoG4,2023,Travaux en cours,"SILENE - Gambetta, Cogedim, CARRERE, MACORETZ, Trécobat, Alliance",,L’ancien complexe sportif est un projet d’ensemble immobilier réparti sur 7 îlots. Il prévoit à terme la création d’environ 367 logements dont 97 en locatif social.,Création d'un nouveau quartier à proximité du centre-ville proposant  environ 350 logements (collectifs et individuels) dont 30 % de logements sociaux.,https://www.saintnazaire.fr/fileadmin/_processed_/5/9/csm_LE_PLESSIS_plan_masse_1cfabeb848.jpg,
"47.2673784852,-2.24875992447","{""type"": ""Point"", ""coordinates"": [-2.248759924472762, 47.267378485209605]}",_515b5a38-5002-11eb-9f5c-cb34563f85d6.,Bayet Escurat,50,1,Habitat,Quartier ouest,60.0,https://bit.ly/3gC5Iam,2025,A l'étude,Ville de Saint-Nazaire,BEAU (espaces public/jardin),,Le site de l'ancienne école Bayet-Escurat va laisser place à une opération de maisons individuelles et de logements intermédiaires.,https://www.saintnazaire.fr/fileadmin/images/BD-Bayet_Escurat_et_Reton_-_vue_aerienne_perimetres_des_operations.jpg,
"47.2857935338,-2.20978100988","{""type"": ""Point"", ""coordinates"": [-2.209781009881613, 47.28579353381278]}",_515b5a38-5002-11eb-9f5c-cb34563f85d6.,Ilot Willy-Brandt,1,1,Habitat,Centre-ville,85.0,https://bit.ly/30mK94p,2022,Travaux en cours,LINKCITY,Tolia et Gilliland,"Ce projet d'entrée de ville prévoit 83 logements, des bureaux, un hôtel et des commerces en rez-de-chaussée autour d'un cœur d'ilot végétalisé.","Ce projet d'entrée de ville prévoit 83 logements, des bureaux, un hôtel et des commerces en rez-de-chaussée autour d'un cœur d'ilot végétalisé.",https://www.saintnazaire.fr/fileadmin/images/BD_VUE_Entree_de_ville_PCM.jpg,Action coeur de ville
"47.280320842,-2.23468780518","{""type"": ""Point"", ""coordinates"": [-2.234687805175779, 47.28032084200327]}",_515b5a38-5002-11eb-9f5c-cb34563f85d6.,Désenclavement de l'ile du Pé,112,1,Equipement / Aménagement,Nord,,https://bit.ly/3uQB4yF,2021,Travaux en cours,Ville de Saint-Nazaire (DPU),Ville de Saint-Nazaire (BEAU),Réalisation d'une voirie pour désenclaver le quartier de l'ile du Pé entre la rue du Petit Bois (résidence Silène) et la rue André Chénier.,,https://www.saintnazaire.fr/fileadmin/images/DSC02221proj.jpg,PRIR
"47.2727069083,-2.19962596893","{""type"": ""Point"", ""coordinates"": [-2.199625968933101, 47.27270690827201]}",_515b5a38-5002-11eb-9f5c-cb34563f85d6.,Ilot Nautique - Plateau du Petit Maroc,170,1,Equipement / Aménagement,,,https://bit.ly/36xsvxE,,,,,"Il s’agit d’un appel à candidature ""Ambition Maritime"" à destination des professionnels de l’immobilier.
Petit Maroc : développement d’activités économiques et de loisirs avec une forte dimension maritime.",,https://www.saintnazaire.fr/fileadmin/_processed_/c/8/csm_SNAG_0185938_17_99af504ab0.jpg,Ambition maritime
"47.2722912892,-2.23196303486","{""type"": ""Point"", ""coordinates"": [-2.231963034859413, 47.27229128919247]}",_515b5a38-5002-11eb-9f5c-cb34563f85d6.,Plaine des sports,9,1,Equipement / Aménagement,Front de mer - Kerlédé,,https://bit.ly/3e4l5qC,2021,Livré,Ville de Saint-Nazaire,BASE,"Le projet de la plaine des sports s'organise autour de plusieurs interventions :
- L'aménagement d'une coulée verte entre le parc paysager et la cité scolaire (réalisé en 2018)
- L'aménagement d'un plateau sportif en pratique libre et d'un parvis paysager en lieu et place de l'ancienne piscine Léo Lagrange 
- La requalification de la piste d'athlétisme
- La transformation de l'ancien local du SNAF en activité de restauration","Entre le parc paysager et la cité scolaire, la plaine des sports est en pleine métamorphose. L'objectif est d'en faire un espace planté, ludique et ouvert aux pratiques sportives libres.",https://www.saintnazaire.fr/fileadmin/images/BD_le_nouveau_plateau_sportif_au_1er_plan_et_la_future_piste_d_athletisme__livraison_Juin_21___c__Projet_BASE.jpg,
"47.2778751854,-2.20383167267","{""type"": ""Point"", ""coordinates"": [-2.203831672668453, 47.277875185406444]}",_515b5a38-5002-11eb-9f5c-cb34563f85d6.,Ecole des beaus-arts - Site Nantes Saint-Nazaire,124,1,Equipement / Aménagement,centre-ville,,https://bit.ly/2ULYtAA,2021,Travaux en cours,Ecole des beaux-arts,agence d'architecture Titan,"D’ici janvier 2022, une classe préparatoire internationale et l’école d’arts seront regroupées dans un seul bâtiment près du Théâtre. Les 120 étudiants attendus se mêleront aux amateurs qui fréquentent régulièrement les ateliers.","D’ici janvier 2022, une classe préparatoire internationale et l’école d’arts seront regroupées dans un seul bâtiment près du Théâtre. Les 120 étudiants attendus se mêleront aux amateurs qui fréquentent régulièrement les ateliers.",https://www.agglo-carene.fr/fileadmin/_processed_/2/c/csm_0046_EBA_DCE_PERSPECTIVE_02_546946c2b3.jpeg,Action coeur de ville
"47.256470868,-2.2472512722","{""type"": ""Point"", ""coordinates"": [-2.247251272201536, 47.25647086796324]}",_515b5a38-5002-11eb-9f5c-cb34563f85d6.,Villa Ker Louis,137,1,Equipement / Aménagement,Front de mer - Kérlédé,,https://bit.ly/3hy7zge,,A l'étude,,,"Il s’agit d’un appel à candidature place à prendre ""Ambition Maritime"". Les candidats sont amenés à proposer différentes activités : animations ludiques et pédagogiques, bar et restauration, hébergements touristiques…",,https://www.saintnazaire.fr/fileadmin/_processed_/c/8/csm_SNAG_0185938_17_99af504ab0.jpg,Ambition maritime
"47.2755022082,-2.23548173904","{""type"": ""Point"", ""coordinates"": [-2.235481739044187, 47.2755022081586]}",_515b5a38-5002-11eb-9f5c-cb34563f85d6.,Moulin du Pé - parking silo est et chapelle,171,1,Equipement / Aménagement,,,https://bit.ly/3kbQbQe,,A l'étude,,,"Il s’agit d’un appel à candidature ""Ambition Maritime"" à destination des professionnels de l’immobilier.
Moulin du Pé (site de l’ancien hôpital) : en complément des opérations déjà lancées, ce projet vise à créer un parking en silo, des logements, des bureaux. Il intègre également l’ancienne chapelle",,https://www.saintnazaire.fr/fileadmin/_processed_/c/8/csm_SNAG_0185938_17_99af504ab0.jpg,Ambition maritime
"47.2758648228,-2.23661190875","{""type"": ""Point"", ""coordinates"": [-2.236611908753136, 47.27586482275105]}",_515b5a38-5002-11eb-9f5c-cb34563f85d6.,Moulin du Pé,44,1,Habitat,Nord,450.0,https://bit.ly/2NPoa3p,2035,A l'étude,SONADEV,Magnum Florence Mercier Ingerop,,"Sur l'ancien site de l'hôpital, une réflexion est en cours avec les Nazairiens afin de définir les grandes orientations pour l'aménagement de ces 9 hectares.",https://www.saintnazaire.fr/fileadmin/_processed_/2/1/csm_Moulin-du-pe_69f16ebde0.jpg,
"47.2781654286,-2.22425767119","{""type"": ""Point"", ""coordinates"": [-2.224257671193933, 47.278165428648364]}",_515b5a38-5002-11eb-9f5c-cb34563f85d6.,Soleil Levant,6,1,Habitat,Centre-ville,75.0,https://bit.ly/3uVzxXU,2022,Travaux en cours,Ville de Saint-Nazaire - SILENE,Vincent Perraud Architecture,Le projet propose une diversité des formes d’habitat entre l’individuel et le collectif. La hauteur des collectifs est adaptée à l’échelle du cœur d’îlot avec une hauteur maximum de 3 étages. Le site présente un environnement verdoyant exceptionnel et le projet vise à maintenir des espaces verts collectifs.,"A proximité du centre-ville, le projet mixe logements individuels et collectifs dont la hauteur en cœur d'ilot est de 3 étages maximum.",https://www.saintnazaire.fr/fileadmin/_processed_/a/d/csm_4_ILOT_B_PRESENTATION_MAIRIE_b1893eec0c.jpg,
"47.2661566609,-2.25084302658","{""type"": ""Point"", ""coordinates"": [-2.250843026584093, 47.26615666092156]}",_515b5a38-5002-11eb-9f5c-cb34563f85d6.,Althéa,46,1,Habitat,Quartier ouest,27.0,https://bit.ly/3sJ0ufG,2022,Travaux en cours,Espacil,KOK Architecte,Construction d'un immeuble de 27 logements du T2 au T4,"Au cœur de la Chesnaie, à deux pas de l'école et de l'espace civique ce projet prévoit 27 logements collectifs en accession sociale.",https://www.saintnazaire.fr/fileadmin/_processed_/4/6/csm_ESPACIL_2_Kok_Architectes_f0eadf4ffb.jpg,
"47.2760913526,-2.23148837513","{""type"": ""Point"", ""coordinates"": [-2.231488375134082, 47.27609135263434]}",_515b5a38-5002-11eb-9f5c-cb34563f85d6.,Jean de Neyman,4,1,Habitat,Nord,75.0,https://bit.ly/3uK6M0m,2023,Travaux en cours,SILENE,Magnum - sixième rue - Mabire Reich,Construction de 75 logements sur le site de l'ancien collège Jean de Neyman,Construction de 75 logements sur le site de l'ancien collège Jean de Neyman,https://www.saintnazaire.fr/fileadmin/_processed_/4/9/csm_Neyman_-_Bouin_localisation_des_projets_7066e2d1ee.jpg,
"47.2555169367,-2.25636005402","{""type"": ""Point"", ""coordinates"": [-2.256360054016108, 47.255516936745735]}",_515b5a38-5002-11eb-9f5c-cb34563f85d6.,Anciennes serres de Porcé,153,1,Habitat,Front de mer - Kerlédé,,https://bit.ly/3k7XwjZ,,A l'étude,,,"Il s’agit d’un appel à candidature ""Ambition Maritime"" à destination des professionnels de l’immobilier.
Anciennes serres de Porcé : création de logements avec 30% de logements sociaux et aménagement d’une traversée piétonne Nord-Sud.
Etudes en cours par Ruelle pour mutualiser les parking avec le collège pour octobre.",,https://www.saintnazaire.fr/fileadmin/_processed_/c/8/csm_SNAG_0185938_17_99af504ab0.jpg,Ambition maritime
"47.2809676156,-2.20722407285","{""type"": ""Point"", ""coordinates"": [-2.207224072852347, 47.280967615633294]}",_515b5a38-5002-11eb-9f5c-cb34563f85d6.,Salengro,27,1,Habitat,centre-ville,40.0,https://bit.ly/2OewAS9,2025,A l'étude,SILENE - Ville de Saint-Nazaire,Urban Maker - BEAU,Projet d'aménagement d'un espace public paysager et d'une quarantaine de logements locatifs sociaux sur le site des anciens ateliers municipaux.,,https://www.saintnazaire.fr/fileadmin/images/BD_Le_centre-ville_de_Saint-Nazaire__Ville_port__le_port__l_estuaire_-_Martin_Launay_2018_09_07.jpg,Action coeur de ville
"47.2684477533,-2.23301075948","{""type"": ""Point"", ""coordinates"": [-2.233010759477847, 47.26844775329957]}",_515b5a38-5002-11eb-9f5c-cb34563f85d6.,Harmony of the sky,20,1,Habitat,Front de mer - Kerlédé,170.0,https://bit.ly/3uTp0fQ,2024,A l'étude,les nouveaux constructeurs,Harmonic + Masson  & Associés,"Ce projet d'architecture contemporaine prévoit 170 logements. Le rez-de chaussé proposera plus de 1 200 m² d'activité (crèche, salles associatives, etc.)","Ce projet d'architecture contemporaine prévoit 170 logements. Le rez-de chaussé proposera plus de 1 200 m² d'activité (crèche, salles associatives, etc.)",https://www.saintnazaire.fr/fileadmin/_processed_/e/2/csm_Vue_depuis_l_avenue_de_Coubertin_50715d0f44.jpg,
"47.2767363084,-2.21390082502","{""type"": ""Point"", ""coordinates"": [-2.213900825020722, 47.276736308376236]}",_515b5a38-5002-11eb-9f5c-cb34563f85d6.,Ilot Lebon,2,1,Habitat,centre-ville,113.0,https://bit.ly/3sYzskP,2023,Travaux en cours,Vinci Immobilier,ARLAB Architectes,"L'ilot Lebon va connaître une métamorphose. S'inscrivant dans la stratégie de redynamisation du centre-ville, c'est un programme de 113 logements qui va naître en lieu et place de l'ancien supermarché Carrefour et du parking Philippe Lebon. L'opération comprend 4 immeubles avec 113 logements dont 47 pour les étudiants.","Inscrit dans la stratégie de redynamisation du centre-ville, ce programme de 113 logements (dont 47 pour les étudiants) est réparti sur 4 immeubles.  Une large place place sera consacrée au végétal.",https://www.saintnazaire.fr/fileadmin/_processed_/e/1/csm_Image1_4e04f6fff7.png,Action coeur de ville
