geo_point_2d,geo_shape,gml_id,nom_du_projet,gid,fiche_diffusable,type,quartier,nombre_de_logements,lien_vers_la_page_internet,annee_de_livraison,etat,maitrise_d_ouvrage,maitrise_d_oeuvre,description_du_projet,description_resumee,image_pour_infobulle_gp,programmes_d_actions
"47.2528441387,-2.25682640076","{""type"": ""Point"", ""coordinates"": [-2.256826400756835, 47.25284413869757]}",_515b5a38-5002-11eb-9f5c-cb34563f85d6.,Gavy,100,1,Equipement / Aménagement,Saint-Marc-sur-mer,,https://bit.ly/3yQepn4,,A l'étude,,,"Il s’agit d’un appel à candidature ""Ambition Maritime"" à destination des professionnels de l’immobilier.
Gavy : l’Université va déménager sur le campus d’Heinlex. Ce projet prévoit le maintien du bâtiment principal. Il pourrait concerner des logements, des bureaux, de l’hôtellerie…",,https://www.saintnazaire.fr/fileadmin/_processed_/c/8/csm_SNAG_0185938_17_99af504ab0.jpg,Ambition maritime
"47.2787632047,-2.21237182617","{""type"": ""Point"", ""coordinates"": [-2.212371826171872, 47.27876320474217]}",_515b5a38-5002-11eb-9f5c-cb34563f85d6.,Campus numérique,123,1,Equipement / Aménagement,centre-ville,,https://bit.ly/3oQM0cF,2023,Travaux en cours,SONADEV,,"Le campus numérique accueillera :
- le CESI - école d'ingénieurs
- un espace de travail destiné à accueillir des entreprises et des évènements
- l'annexe (CESI et des entreprises du numérique)
- le Blue Lab, espace d'innovation et de création","Le campus numérique accueillera :
- le CESI - école d'ingénieurs
- un espace de travail destiné à accueillir des entreprises et des évènements
- l'annexe (CESI et des entreprises du numérique)
- le Blue Lab, espace d'innovation et de création",https://www.saintnazaire.fr/fileadmin/_processed_/3/4/csm_ACS_LE_PAQUEBOT_EXTERIEUR_ENSEIGNES_ENTREE_CESI_2020_11_02_397d88fdd9.jpg,Action coeur de ville
"47.2656316877,-2.22822732485","{""type"": ""Point"", ""coordinates"": [-2.228227324853661, 47.26563168774037]}",_515b5a38-5002-11eb-9f5c-cb34563f85d6.,EcoQuartier de Sautron,28,1,Habitat,Front de mer - Kerlédé,113.0,https://bit.ly/3e97HBU,2023,Travaux en cours,SONADEV - SILENE - CISN,,"A deux pas des commerces et du front de mer, ce projet prévoit une centaine de logements répondant à des exigences environnementales fortes, afin d’obtenir le label national « EcoQuartier ».","A deux pas des commerces et du front de mer, ce projet prévoit une centaine de logements répondant à des exigences environnementales fortes, afin d’obtenir le label national « EcoQuartier ».",https://www.saintnazaire.fr/fileadmin/_processed_/b/2/csm_2017_07_SAUTRON_-_Projet_CISN_-_vue_sud_depuis_l_espace_vert_centrale_6e482ffd4f.jpg,
"47.254373653,-2.25496530533","{""type"": ""Point"", ""coordinates"": [-2.254965305328366, 47.25437365302872]}",_515b5a38-5002-11eb-9f5c-cb34563f85d6.,Vallon de Porcé - Base nautique,120,1,Equipement / Aménagement,Front de mer - Kerlédé,,https://bit.ly/2O1OlDM,,A l'étude,,,"Appel à projet immobilier Ambition maritime sur le site des anciennes serres.
Valoriser et restructurer le parc de Porcé (création d'un parc de bord de mer)
Création d'une base nautique (rénovation, extension de la villa des Mouettes)
Création d'un accès à la mer pour la base nautique","Appel à projet immobilier Ambition maritime sur le site des anciennes serres.
Valoriser et restructurer le parc de Porcé (création d'un parc de bord de mer)
Création d'une base nautique (rénovation, extension de la villa des Mouettes)
Création d'un accès à la mer pour la base nautique.",https://www.saintnazaire.fr/fileadmin/images/SNAG_0067934_17.jpg,
"47.2881789439,-2.24893069613","{""type"": ""Point"", ""coordinates"": [-2.248930696125167, 47.288178943913394]}",_515b5a38-5002-11eb-9f5c-cb34563f85d6.,Virée Rouillard,61,1,Habitat,Immaculée,33.0,https://bit.ly/36brRGd,2024,A l'étude,SILENE,,"-	33 logements type longères (R+1+ Combles max)
-	8 corps de bâtiment (4 maisons groupées ; 4 intermédiaires)",,https://www.saintnazaire.fr/fileadmin/images/Viree_Rouillard_2.jpg,
"47.2956654845,-2.19162225723","{""type"": ""Point"", ""coordinates"": [-2.191622257232662, 47.29566548452289]}",_515b5a38-5002-11eb-9f5c-cb34563f85d6.,Halle de Penhoët,80,1,Equipement / Aménagement,Méan-Penhoët,,https://bit.ly/3bQrEu8,fin 2021,Travaux en cours,,,Réhabilitation des Halles de Méan-Penhoët et animation du lieu avec une convention d'occupation avec la SOCALI,,https://www.saintnazaire.fr/fileadmin/images/BD_Bain_douches_et_halles_de_Penhoet_-_Bruno_Bouvry_2017_05_16.jpg,
"47.2775403546,-2.21151351929","{""type"": ""Point"", ""coordinates"": [-2.211513519287106, 47.277540354574676]}",_515b5a38-5002-11eb-9f5c-cb34563f85d6.,Centre de santé Médic Global,149,1,Equipement / Aménagement,centre-ville,,https://bit.ly/3lMax1b,2023,A l'étude,SONADEV,ARLAB,"Médic Global regroupe sur un même site les professionnels de santé et de soins médicaux, paramédicaux et les commerces liés à la santé de façon à créer une offre de santé diversifiée et complémentaire dans un seul et unique lieu et de proposer une expérience de prise en charge de la patientèle optimale.","Médic Global regroupe sur un même site les professionnels de santé et de soins médicaux, paramédicaux et les commerces liés à la santé de façon à créer une offre de santé diversifiée et complémentaire dans un seul et unique lieu et de proposer une expérience de prise en charge de la patientèle optimale.",https://www.saintnazaire.fr/fileadmin/_processed_/6/c/csm_Medic_Global_Perspective_827ecea201.jpg,Action coeur de ville
"47.2756510291,-2.21969789792","{""type"": ""Point"", ""coordinates"": [-2.2196978979158, 47.27565102912294]}",_515b5a38-5002-11eb-9f5c-cb34563f85d6.,Conservatoire à Rayonnement Départemental,72,1,Equipement / Aménagement,Centre-ville,,https://bit.ly/385fgpl,2023,A l'étude,Ville de Saint-Nazaire,ARCHIDEV,"Dans son projet stratégique, l’équipe municipale a souhaité rénover et étendre le Conservatoire Boris-Vian. Objectifs : améliorer son fonctionnement, favoriser la pratique collective et soutenir l’apprentissage et le perfectionnement de la danse et de la musique à Saint-Nazaire.","Afin d'améliorer son fonctionnement, de favoriser la pratique collective et de soutenir l’apprentissage et le perfectionnement de la danse et de la musique, le conservatoire va faire l'objet d'une rénovation/extension.",https://www.saintnazaire.fr/fileadmin/images/Perspectives_rue_Pierre_de_Bayard.jpg,
