ComplainantCategory,Stage,ComplaintDetails,DateComplaintReceived,DateAcknowledged,OriginalDueDateForResponse,DateFinalResponseSent,FormalNotificationOfInvestigationByThePHSO,FormalNotificationOfOutcomeByThePHSO,Outcome,Workingdaystakentorespond,Improvementsmadeasaresultofcomplaint
Other,1,Language used in correspondence from the FSA,2019-02-19,,2019-04-16,2019-02-26,,,Not upheld,5.0,
Member of public,1,Lack of action by the FSA in relation to the illegal sale of a product,2019-02-19,2019-02-22,2019-04-16,2019-04-18,,,Partially upheld,42.0,adjustments were already made to how FSA manage equivalent cases
Other,1,FSA Communications and actions relating to an animal slaughter at an abbattoir,2019-03-19,2019-03-28,2019-05-17,2019-05-24,,,Partially upheld,45.0,
Member of public,2,FSA response at stage 1 of the complaint process and failure to take action against the relevant FSA staff,2019-04-29,2019-04-30,2019-06-26,2019-06-12,,,Not upheld,29.0,
Other,2, FSA failure to comply with the normal business agreement between a Food Business Operator and the FSA. FSA staff allowing the slaughter of another species at the Food Business Operators premises.  ,2019-07-11,2019-07-18,2019-09-06,2019-09-05,,,Partially upheld,39.0,clear agreements to be established in repeat circumstances 
Food Business Operator,1,FSA charges levied against a Food Business Operator,2019-07-30,2019-08-09,2019-09-25,2019-10-11,,,Not upheld,52.0,
Food Business Operator,2, FSA failure to properly notify a Food Business Operator of changes in its charging regime,2019-11-07,2020-01-08,2020-01-07,2020-02-18,,,Partially upheld,70.0,
Member of public,3,FSA processes and handling of a complaint in relation to the illegal sale of a product,,,,,2020-01-29,On going,Awaited,,
